{"schemaVersion":1,"publicationSHA256":"f97de0fa662df0d693a7b27d03eccc914daf540434e5d6fa649db3a951b31457","proofRevision":1,"proofBodySHA256":"82aa193020cc29533af095eef5fe044aa2f7480a28a2e2ee25fc02037177c346","proofBodyBase64":"ewogICJzY2hlbWFWZXJzaW9uIjogMSwKICAicHVibGljYXRpb24iOiB7CiAgICAidXJsIjogImh0dHBzOi8vdGZsLmdvdi51ay90Zmwvc3luZGljYXRpb24vZmVlZHMvam91cm5leS1wbGFubmVyLXRpbWV0YWJsZXMuemlwIiwKICAgICJzaGEyNTYiOiAiZjk3ZGUwZmE2NjJkZjBkNjkzYTdiMjdkMDNlY2NjOTE0ZGFmNTQwNDM0ZTVkNmZhNjQ5ZGIzYTk1MWIzMTQ1NyIsCiAgICAicHVibGlzaGVkQXQiOiAiTW9uLCAwNSBPY3QgMjAyNiAxMDozOTozOSBHTVQiLAogICAgImNhcHR1cmVkQXQiOiAiMjAyNi0xMC0wN1QxMDo1NTo1OS42NzJaIgogIH0sCiAgInRpbWV6b25lIjogIkV1cm9wZS9Mb25kb24iLAogICJiYW5rSG9saWRheURhdGVzIjogWwogICAgIjIwMTktMDEtMDEiLAogICAgIjIwMTktMDQtMTkiLAogICAgIjIwMTktMDQtMjIiLAogICAgIjIwMTktMDUtMDYiLAogICAgIjIwMTktMDUtMjciLAogICAgIjIwMTktMDgtMjYiLAogICAgIjIwMTktMTItMjUiLAogICAgIjIwMTktMTItMjYiLAogICAgIjIwMjAtMDEtMDEiLAogICAgIjIwMjAtMDQtMTAiLAogICAgIjIwMjAtMDQtMTMiLAogICAgIjIwMjAtMDUtMDgiLAogICAgIjIwMjAtMDUtMjUiLAogICAgIjIwMjAtMDgtMzEiLAogICAgIjIwMjAtMTItMjUiLAogICAgIjIwMjAtMTItMjgiLAogICAgIjIwMjEtMDEtMDEiLAogICAgIjIwMjEtMDQtMDIiLAogICAgIjIwMjEtMDQtMDUiLAogICAgIjIwMjEtMDUtMDMiLAogICAgIjIwMjEtMDUtMzEiLAogICAgIjIwMjEtMDgtMzAiLAogICAgIjIwMjEtMTItMjciLAogICAgIjIwMjEtMTItMjgiLAogICAgIjIwMjItMDEtMDMiLAogICAgIjIwMjItMDQtMTUiLAogICAgIjIwMjItMDQtMTgiLAogICAgIjIwMjItMDUtMDIiLAogICAgIjIwMjItMDYtMDIiLAogICAgIjIwMjItMDYtMDMiLAogICAgIjIwMjItMDgtMjkiLAogICAgIjIwMjItMDktMTkiLAogICAgIjIwMjItMTItMjYiLAogICAgIjIwMjItMTItMjciLAogICAgIjIwMjMtMDEtMDIiLAogICAgIjIwMjMtMDQtMDciLAogICAgIjIwMjMtMDQtMTAiLAogICAgIjIwMjMtMDUtMDEiLAogICAgIjIwMjMtMDUtMDgiLAogICAgIjIwMjMtMDUtMjkiLAogICAgIjIwMjMtMDgtMjgiLAogICAgIjIwMjMtMTItMjUiLAogICAgIjIwMjMtMTItMjYiLAogICAgIjIwMjQtMDEtMDEiLAogICAgIjIwMjQtMDMtMjkiLAogICAgIjIwMjQtMDQtMDEiLAogICAgIjIwMjQtMDUtMDYiLAogICAgIjIwMjQtMDUtMjciLAogICAgIjIwMjQtMDgtMjYiLAogICAgIjIwMjQtMTItMjUiLAogICAgIjIwMjQtMTItMjYiLAogICAgIjIwMjUtMDEtMDEiLAogICAgIjIwMjUtMDQtMTgiLAogICAgIjIwMjUtMDQtMjEiLAogICAgIjIwMjUtMDUtMDUiLAogICAgIjIwMjUtMDUtMjYiLAogICAgIjIwMjUtMDgtMjUiLAogICAgIjIwMjUtMTItMjUiLAogICAgIjIwMjUtMTItMjYiLAogICAgIjIwMjYtMDEtMDEiLAogICAgIjIwMjYtMDQtMDMiLAogICAgIjIwMjYtMDQtMDYiLAogICAgIjIwMjYtMDUtMDQiLAogICAgIjIwMjYtMDUtMjUiLAogICAgIjIwMjYtMDgtMzEiLAogICAgIjIwMjYtMTItMjUiLAogICAgIjIwMjYtMTItMjgiLAogICAgIjIwMjctMDEtMDEiLAogICAgIjIwMjctMDMtMjYiLAogICAgIjIwMjctMDMtMjkiLAogICAgIjIwMjctMDUtMDMiLAogICAgIjIwMjctMDUtMzEiLAogICAgIjIwMjctMDgtMzAiLAogICAgIjIwMjctMTItMjciLAogICAgIjIwMjctMTItMjgiLAogICAgIjIwMjgtMDEtMDMiLAogICAgIjIwMjgtMDQtMTQiLAogICAgIjIwMjgtMDQtMTciLAogICAgIjIwMjgtMDUtMDEiLAogICAgIjIwMjgtMDUtMjkiLAogICAgIjIwMjgtMDgtMjgiLAogICAgIjIwMjgtMTItMjUiLAogICAgIjIwMjgtMTItMjYiCiAgXSwKICAiaG9saWRheVNvdXJjZSI6ICJodHRwczovL3d3dy5nb3YudWsvYmFuay1ob2xpZGF5cy5qc29uIiwKICAiaG9saWRheUNvdmVyYWdlU3RhcnQiOiAiMjAxOS0wMS0wMSIsCiAgImhvbGlkYXlDb3ZlcmFnZUVuZCI6ICIyMDI4LTEyLTI2IiwKICAiY2Fub25pY2FsS2V5IjogImV4dGVuZGVkTWludXRlKDQgQVNDSUkgZGlnaXRzKXxvcmRlcmVkIEFQSSBpbnRlcnZhbCBzdG9wIElEcyBqb2luZWQgd2l0aCA+OyBzb3J0ZWQgTEYga2V5czsgcHJlc2VydmUgZHVwbGljYXRlcyIsCiAgInNvdXJjZVBhcml0eUVxdWl2YWxlbmNlIjogIkNvbXBhcmUgZWFjaCBhcHBsaWNhYmxlIHB1Ymxpc2hlciBtZW1iZXIgY29tcGxldGUgY291bnRlZCBjYWxsaW5nIG11bHRpc2V0IHBlciBvcmlnaW5hdGluZyBkYXRlOyBvdmVybGFwcGluZyBtZW1iZXJzIG11c3QgYWdyZWUsIG5ldmVyIHN1bSBvciBvdmVycmlkZS4gT21pdCBvbmx5IGV4cGxpY2l0IHBhc3MgYWN0aXZpdHk7IGFkamFjZW50IEFQSSB0aW1pbmcgaW50ZXJ2YWxzIGhhdmUgbG9naWNhbCBzdGF0aW9uIHBhcml0eS4gUmV0YWluIG5vbmFkamFjZW50IHJldmlzaXRzL2R1cGxpY2F0ZSBqb3VybmV5cy4gUGVyLXByb2ZpbGUgYWdyZWVkLWRhdGUgbWF4aW11bSBhY2NvdW50cyBmb3IgcmF3IGtleXM7IGV4YWN0IGNvdW50ZWQgZXhjbHVzaW9ucyBhbmQgYm91bmRlZCBkYXRlIHJhbmdlcyBxdWFsaWZ5IGNvbXBsZXRlIG9yaWdpbmF0aW5nIHN1YnNldHMuIiwKICAicXVhbGlmaWNhdGlvblNjb3BlIjogIk9yaWdpbiBkZXBhcnR1cmVzIHBsdXMgZXhwbGljaXRseSBjYXB0dXJlZCBkaXJlY3Rpb24tc2NvcGVkIHNlbGVjdGVkIGNhbGxpbmctc3RvcCBkZXBhcnR1cmVzLiBFdmVyeSBiYW5rIGhvbGlkYXkgaXMgY29uc2VydmF0aXZlbHkgd2l0aGhlbGQuIFJ1bnRpbWUgcHVibGljYXRpb24vcGFyaXR5L2ZyZXNobmVzcy9jYWxlbmRhci9jbG9zdXJlIHF1YWxpZmljYXRpb24gcmVtYWlucyByZXF1aXJlZC4iLAogICJlbnRyaWVzIjogWwogICAgewogICAgICAibGluZUlEIjogImJha2VybG9vIiwKICAgICAgInN0YXRpb25JRCI6ICI5NDBHWlpMVUhBVyIsCiAgICAgICJzdGF0dXMiOiAicXVhbGlmaWVkIiwKICAgICAgImdhcFJlYXNvbiI6IG51bGwsCiAgICAgICJub25PcGVyYXRpb25CYW5rSG9saWRheXMiOiB0cnVlLAogICAgICAicHJvZmlsZXMiOiBbCiAgICAgICAgewogICAgICAgICAgIm5hbWUiOiAiTW9uZGF5IC0gRnJpZGF5IiwKICAgICAgICAgICJjb3VudCI6IDgzLAogICAgICAgICAgInNoYTI1NiI6ICJjYTNiM2M1ZDA1ZjJlNWZiMTg1NTMxMjBlNmQwNmQzMWFhNmFhYzhkNDFlY2FiMzk5NTU2MjhkYzY5NDFmNzBjIiwKICAgICAgICAgICJ3ZWVrZGF5cyI6IFsKICAgICAgICAgICAgMiwKICAgICAgICAgICAgMywKICAgICAgICAgICAgNCwKICAgICAgICAgICAgNSwKICAgICAgICAgICAgNgogICAgICAgICAgXSwKICAgICAgICAgICJvcmlnaW5hdGluZ1NlcnZpY2VEYXRlUmFuZ2VzIjogWwogICAgICAgICAgICB7CiAgICAgICAgICAgICAgInN0YXJ0RGF0ZSI6ICIyMDI2LTA5LTAzIiwKICAgICAgICAgICAgICAiZW5kRGF0ZSI6ICIyMDI2LTEyLTIzIgogICAgICAgICAgICB9CiAgICAgICAgICBdCiAgICAgICAgfSwKICAgICAgICB7CiAgICAgICAgICAibmFtZSI6ICJTdW5kYXkiLAogICAgICAgICAgImNvdW50IjogNjcsCiAgICAgICAgICAic2hhMjU2IjogImFjNzdjNzFhNWJmYTc2MDNhYWVkOGNmNTc0Mzc4MTI1ZDY4YTJjOGFhYTUyNDUyYjJjNDI3OWM2NjhhYTBlNWYiLAogICAgICAgICAgIndlZWtkYXlzIjogWwogICAgICAgICAgICAxCiAgICAgICAgICBdLAogICAgICAgICAgIm9yaWdpbmF0aW5nU2VydmljZURhdGVSYW5nZXMiOiBbCiAgICAgICAgICAgIHsKICAgICAgICAgICAgICAic3RhcnREYXRlIjogIjIwMjYtMDktMDMiLAogICAgICAgICAgICAgICJlbmREYXRlIjogIjIwMjYtMTItMjMiCiAgICAgICAgICAgIH0KICAgICAgICAgIF0KICAgICAgICB9LAogICAgICAgIHsKICAgICAgICAgICJuYW1lIjogIlNhdHVyZGF5cyBhbmQgUHVibGljIEhvbGlkYXlzIiwKICAgICAgICAgICJjb3VudCI6IDc2LAogICAgICAgICAgInNoYTI1NiI6ICIyN2JmYzQxMzhjZThiNDAxYTNlMGUwMDRiMTVjZDNlOGVlNWE1MmMxODk1ZjNhNmY0MzRjYjA4ODAwMzc3NjU0IiwKICAgICAgICAgICJ3ZWVrZGF5cyI6IFsKICAgICAgICAgICAgNwogICAgICAgICAgXSwKICAgICAgICAgICJvcmlnaW5hdGluZ1NlcnZpY2VEYXRlUmFuZ2VzIjogWwogICAgICAgICAgICB7CiAgICAgICAgICAgICAgInN0YXJ0RGF0ZSI6ICIyMDI2LTA5LTAzIiwKICAgICAgICAgICAgICAiZW5kRGF0ZSI6ICIyMDI2LTEyLTIzIgogICAgICAgICAgICB9CiAgICAgICAgICBdCiAgICAgICAgfQogICAgICBdLAogICAgICAib3BlcmF0aW5nU3RhcnREYXRlIjogIjIwMjYtMDktMDMiLAogICAgICAib3BlcmF0aW5nRW5kRGF0ZSI6ICIyMDI2LTEyLTIzIiwKICAgICAgIm9yaWdpbmF0aW5nRGF0ZUdhcHMiOiBbXSwKICAgICAgInhtbE1lbWJlcnMiOiBbCiAgICAgICAgInRmbF8xLUJBSy1fLXkwNS02MzUyMDEueG1sIgogICAgICBdLAogICAgICAiYXBpQm9keVNIQTI1NiI6ICJmYjY2YTFjMmQyZDdiMWE4NmIwYTdiMTY1MDc3YjE1OGU1ZjRmNGNkYzg5MmU2MTgwYzIxODcxZmYxODMyZDJhIgogICAgfSwKICAgIHsKICAgICAgImxpbmVJRCI6ICJjZW50cmFsIiwKICAgICAgInN0YXRpb25JRCI6ICI5NDBHWlpMVUVQRyIsCiAgICAgICJzdGF0dXMiOiAicXVhbGlmaWVkIiwKICAgICAgImdhcFJlYXNvbiI6IG51bGwsCiAgICAgICJub25PcGVyYXRpb25CYW5rSG9saWRheXMiOiB0cnVlLAogICAgICAicHJvZmlsZXMiOiBbCiAgICAgICAgewogICAgICAgICAgIm5hbWUiOiAiU2F0dXJkYXkgKGFsc28gR29vZCBGcmlkYXkpIiwKICAgICAgICAgICJjb3VudCI6IDE3MCwKICAgICAgICAgICJzaGEyNTYiOiAiYjYyZGE5MTRjMTIwYmU5YmJkYzZiNGFjNWUxNzY5YTVlZjVkMWVhMDllYmJiYWQ5ZjhkNzdjNTIyZjQyZjlmMiIsCiAgICAgICAgICAid2Vla2RheXMiOiBbCiAgICAgICAgICAgIDcKICAgICAgICAgIF0sCiAgICAgICAgICAib3JpZ2luYXRpbmdTZXJ2aWNlRGF0ZVJhbmdlcyI6IFsKICAgICAgICAgICAgewogICAgICAgICAgICAgICJzdGFydERhdGUiOiAiMjAyNi0wOS0yOCIsCiAgICAgICAgICAgICAgImVuZERhdGUiOiAiMjAyNi0xMi0yMyIKICAgICAgICAgICAgfQogICAgICAgICAgXQogICAgICAgIH0sCiAgICAgICAgewogICAgICAgICAgIm5hbWUiOiAiTW9uZGF5IC0gVGh1cnNkYXkiLAogICAgICAgICAgImNvdW50IjogMTcxLAogICAgICAgICAgInNoYTI1NiI6ICJmNzQyNmIwZjUyMTNmNTg3ZTlmNDY2MjRmZjlkODJiNzZmOGY4MmZhNjcxODE5ZjE3NTBhMDEyMzkwZTM0NDdhIiwKICAgICAgICAgICJ3ZWVrZGF5cyI6IFsKICAgICAgICAgICAgMiwKICAgICAgICAgICAgMywKICAgICAgICAgICAgNCwKICAgICAgICAgICAgNQogICAgICAgICAgXSwKICAgICAgICAgICJvcmlnaW5hdGluZ1NlcnZpY2VEYXRlUmFuZ2VzIjogWwogICAgICAgICAgICB7CiAgICAgICAgICAgICAgInN0YXJ0RGF0ZSI6ICIyMDI2LTA5LTI4IiwKICAgICAgICAgICAgICAiZW5kRGF0ZSI6ICIyMDI2LTEyLTIzIgogICAgICAgICAgICB9CiAgICAgICAgICBdCiAgICAgICAgfSwKICAgICAgICB7CiAgICAgICAgICAibmFtZSI6ICJGcmlkYXkiLAogICAgICAgICAgImNvdW50IjogMTcxLAogICAgICAgICAgInNoYTI1NiI6ICJiYmNlN2UwYmM1ZDUyNDc1YzBmYzUzZTFjZjMyMDNhYjg2MWNhZDZlODQ2ZTgzZTJkOGRlMWRiZjI5Y2MzZTY4IiwKICAgICAgICAgICJ3ZWVrZGF5cyI6IFsKICAgICAgICAgICAgNgogICAgICAgICAgXSwKICAgICAgICAgICJvcmlnaW5hdGluZ1NlcnZpY2VEYXRlUmFuZ2VzIjogWwogICAgICAgICAgICB7CiAgICAgICAgICAgICAgInN0YXJ0RGF0ZSI6ICIyMDI2LTA5LTI4IiwKICAgICAgICAgICAgICAiZW5kRGF0ZSI6ICIyMDI2LTEyLTIzIgogICAgICAgICAgICB9CiAgICAgICAgICBdCiAgICAgICAgfSwKICAgICAgICB7CiAgICAgICAgICAibmFtZSI6ICJTdW5kYXkiLAogICAgICAgICAgImNvdW50IjogMTM4LAogICAgICAgICAgInNoYTI1NiI6ICJmMGQwNDNmMTZlZGRjOWY0MzhmNTcyNTkxMTQyNDNjMDI3NmE5NGFhZjhkOTgzN2FjYTU2MzA1NzJkOTg4ZDE4IiwKICAgICAgICAgICJ3ZWVrZGF5cyI6IFsKICAgICAgICAgICAgMQogICAgICAgICAgXSwKICAgICAgICAgICJvcmlnaW5hdGluZ1NlcnZpY2VEYXRlUmFuZ2VzIjogWwogICAgICAgICAgICB7CiAgICAgICAgICAgICAgInN0YXJ0RGF0ZSI6ICIyMDI2LTA5LTI4IiwKICAgICAgICAgICAgICAiZW5kRGF0ZSI6ICIyMDI2LTEwLTEwIgogICAgICAgICAgICB9LAogICAgICAgICAgICB7CiAgICAgICAgICAgICAgInN0YXJ0RGF0ZSI6ICIyMDI2LTEwLTEyIiwKICAgICAgICAgICAgICAiZW5kRGF0ZSI6ICIyMDI2LTEyLTIzIgogICAgICAgICAgICB9CiAgICAgICAgICBdCiAgICAgICAgfQogICAgICBdLAogICAgICAib3BlcmF0aW5nU3RhcnREYXRlIjogIjIwMjYtMDktMjgiLAogICAgICAib3BlcmF0aW5nRW5kRGF0ZSI6ICIyMDI2LTEyLTIzIiwKICAgICAgIm9yaWdpbmF0aW5nRGF0ZUdhcHMiOiBbCiAgICAgICAgewogICAgICAgICAgInNlcnZpY2VEYXRlIjogIjIwMjYtMTAtMTEiLAogICAgICAgICAgInJlYXNvbiI6ICJwdWJsaWNhdGlvbiBtZW1iZXIgY29uZmxpY3QiCiAgICAgICAgfQogICAgICBdLAogICAgICAieG1sTWVtYmVycyI6IFsKICAgICAgICAidGZsXzEtQ0VOLV8teTA1LTcxMDgxMC54bWwiLAogICAgICAgICJ0ZmxfMS1DRU4tXy15MDUtODI2NjEwMi54bWwiCiAgICAgIF0sCiAgICAgICJhcGlCb2R5U0hBMjU2IjogIjkwNGY0MWI5MDM5YWJjZjViYTliODdmNDExYjNhZDI1ZWViYzU2OGExNzIyNzU3Yzc4ODRiZWE1YjViMTQ4OTQiCiAgICB9LAogICAgewogICAgICAibGluZUlEIjogImNlbnRyYWwiLAogICAgICAic3RhdGlvbklEIjogIjk0MEdaWkxVV09GIiwKICAgICAgInN0YXR1cyI6ICJnYXAiLAogICAgICAiZ2FwUmVhc29uIjogIndyb25nIGxpbmUgb3Igc3RhdGlvbiIsCiAgICAgICJub25PcGVyYXRpb25CYW5rSG9saWRheXMiOiB0cnVlLAogICAgICAicHJvZmlsZXMiOiBbXQogICAgfSwKICAgIHsKICAgICAgImxpbmVJRCI6ICJjaXJjbGUiLAogICAgICAic3RhdGlvbklEIjogIjk0MEdaWkxVRVJDIiwKICAgICAgInN0YXR1cyI6ICJnYXAiLAogICAgICAiZ2FwUmVhc29uIjogIkFQSSBvbWl0cyBhY3RpdmUgWE1MIGNhbGVuZGFyIHByb2ZpbGUiLAogICAgICAibm9uT3BlcmF0aW9uQmFua0hvbGlkYXlzIjogdHJ1ZSwKICAgICAgInByb2ZpbGVzIjogW10KICAgIH0sCiAgICB7CiAgICAgICJsaW5lSUQiOiAiY2lyY2xlIiwKICAgICAgInN0YXRp